Return-path: <linux-dvb-bounces+mchehab=infradead.org@linuxtv.org>
Received: from moutng.kundenserver.de ([212.227.126.177])
	by www.linuxtv.org with esmtp (Exim 4.63)
	(envelope-from <thomas@ickes-home.de>) id 1KJuHC-0007bP-U3
	for linux-dvb@linuxtv.org; Fri, 18 Jul 2008 20:01:58 +0200
From: tom <thomas@ickes-home.de>
To: linux-dvb@linuxtv.org
Date: Fri, 18 Jul 2008 19:55:09 +0200
Message-Id: <1216403709.10841.20.camel@super-klappi>
Mime-Version: 1.0
Subject: [linux-dvb] Problems with MSI Digivox Duo DVB-T USB, Ubuntu 8.04
List-Unsubscribe: <http://www.linuxtv.org/cgi-bin/mailman/listinfo/linux-dvb>,
	<mailto:linux-dvb-request@linuxtv.org?subject=unsubscribe>
List-Archive: <http://www.linuxtv.org/pipermail/linux-dvb>
List-Post: <mailto:linux-dvb@linuxtv.org>
List-Help: <mailto:linux-dvb-request@linuxtv.org?subject=help>
List-Subscribe: <http://www.linuxtv.org/cgi-bin/mailman/listinfo/linux-dvb>,
	<mailto:linux-dvb-request@linuxtv.org?subject=subscribe>
Content-Type: text/plain; charset="us-ascii"
Content-Transfer-Encoding: 7bit
Sender: linux-dvb-bounces@linuxtv.org
Errors-To: linux-dvb-bounces+mchehab=infradead.org@linuxtv.org
List-ID: <linux-dvb@linuxtv.org>

Hello,
since a few days I'm trying hard make this stick running. One basic problem is that I'm not able to find out which chipset is in this
stick.
I have tried af9015 driver and firmware, but it doesn't work.
Does anybody have the same problem or even solved it?

dmesg | grep usb:

[19614.849918] usb 3-3: USB disconnect, address 5
[19618.108978] usb 3-3: new high speed USB device using ehci_hcd and address 6
[19618.244872] usb 3-3: configuration #1 chosen from 1 choice


lsusb -v :

Bus 003 Device 005: ID 1462:8801 Micro Star International 
Device Descriptor:
  bLength                18
  bDescriptorType         1
  bcdUSB               2.00
  bDeviceClass            0 (Defined at Interface level)
  bDeviceSubClass         0 
  bDeviceProtocol         0 
  bMaxPacketSize0        64
  idVendor           0x1462 Micro Star International
  idProduct          0x8801 
  bcdDevice            2.00
  iManufacturer           1 Afatech
  iProduct                2 DVB-T 2
  iSerial                 0 
  bNumConfigurations      1
  Configuration Descriptor:
    bLength                 9
    bDescriptorType         2
    wTotalLength           46
    bNumInterfaces          1
    bConfigurationValue     1
    iConfiguration          0 
    bmAttributes         0x80
      (Bus Powered)
    MaxPower              500mA
    Interface Descriptor:
      bLength                 9
      bDescriptorType         4
      bInterfaceNumber        0
      bAlternateSetting       0
      bNumEndpoints           4
      bInterfaceClass       255 Vendor Specific Class
      bInterfaceSubClass      0 
      bInterfaceProtocol      0 
      iInterface              0 
      Endpoint Descriptor:
        bLength                 7
        bDescriptorType         5
        bEndpointAddress     0x81  EP 1 IN
        bmAttributes            2
          Transfer Type            Bulk
          Synch Type               None
          Usage Type               Data
        wMaxPacketSize     0x0200  1x 512 bytes
        bInterval               0
      Endpoint Descriptor:
        bLength                 7
        bDescriptorType         5
        bEndpointAddress     0x02  EP 2 OUT
        bmAttributes            2
          Transfer Type            Bulk
          Synch Type               None
          Usage Type               Data
        wMaxPacketSize     0x0200  1x 512 bytes
        bInterval               0
      Endpoint Descriptor:
        bLength                 7
        bDescriptorType         5
        bEndpointAddress     0x84  EP 4 IN
        bmAttributes            2
          Transfer Type            Bulk
          Synch Type               None
          Usage Type               Data
        wMaxPacketSize     0x0200  1x 512 bytes
        bInterval               0
      Endpoint Descriptor:
        bLength                 7
        bDescriptorType         5
        bEndpointAddress     0x85  EP 5 IN
        bmAttributes            2
          Transfer Type            Bulk
          Synch Type               None
          Usage Type               Data
        wMaxPacketSize     0x0200  1x 512 bytes
        bInterval               0

Thomas


_______________________________________________
linux-dvb mailing list
linux-dvb@linuxtv.org
http://www.linuxtv.org/cgi-bin/mailman/listinfo/linux-dvb
