Return-path: <linux-dvb-bounces+mchehab=infradead.org@linuxtv.org>
Received: from smeagol.cambrium.nl ([217.19.16.145] ident=qmailr)
	by www.linuxtv.org with esmtp (Exim 4.63)
	(envelope-from <jelledejong@powercraft.nl>) id 1JUr2s-0008EP-UW
	for linux-dvb@linuxtv.org; Thu, 28 Feb 2008 23:16:07 +0100
Message-ID: <47C7329F.7030705@powercraft.nl>
Date: Thu, 28 Feb 2008 23:15:59 +0100
From: Jelle de Jong <jelledejong@powercraft.nl>
MIME-Version: 1.0
To: linux-dvb <linux-dvb@linuxtv.org>,
	Markus Rechberger <mrechberger@gmail.com>
Content-Type: multipart/mixed; boundary="------------060602040104030307040605"
Subject: [linux-dvb] Going though hell here,
 please provide how to for Pinnacle PCTV Hybrid Pro Stick 330e
List-Unsubscribe: <http://www.linuxtv.org/cgi-bin/mailman/listinfo/linux-dvb>,
	<mailto:linux-dvb-request@linuxtv.org?subject=unsubscribe>
List-Archive: <http://www.linuxtv.org/pipermail/linux-dvb>
List-Post: <mailto:linux-dvb@linuxtv.org>
List-Help: <mailto:linux-dvb-request@linuxtv.org?subject=help>
List-Subscribe: <http://www.linuxtv.org/cgi-bin/mailman/listinfo/linux-dvb>,
	<mailto:linux-dvb-request@linuxtv.org?subject=subscribe>
Sender: linux-dvb-bounces@linuxtv.org
Errors-To: linux-dvb-bounces+mchehab=infradead.org@linuxtv.org
List-ID: <linux-dvb@linuxtv.org>

This is a multi-part message in MIME format.
--------------060602040104030307040605
Content-Type: text/plain; charset=ISO-8859-1; format=flowed
Content-Transfer-Encoding: 7bit

This message contains the following attachment(s):
Pinnacle PCTV Hybrid Pro Stick 330e.txt

Spent my hole day trying to get a dvd-t device up and running, this is 
device number two I tried.

Can somebody please tell me how to get this device working on:

2.6.24-1-686 debian sid and 2.6.22-14-generic ubuntu

I have to get some sleep now, because this is getting on my health and 
that does not happen often....

All needed info is in the attachment.

Thanks for all the efforts, i have the feeling we were almost there....

Kind regards,

Jelle de Jong

--------------060602040104030307040605
Content-Type: text/plain;
 name="Pinnacle PCTV Hybrid Pro Stick 330e.txt"
Content-Transfer-Encoding: 7bit
Content-Disposition: inline;
 filename="Pinnacle PCTV Hybrid Pro Stick 330e.txt"

sudo apt-get install dvb-utils

http://www.linuxtv.org/v4lwiki/index.php/Pinnacle/330e
http://www.linuxtv.org/wiki/index.php/DVB_via_USB
http://lunapark6.com/usb-hdtv-tuner-stick-for-windows-linux-hauppauge-wintv-hvr-950.html
http://www.wi-bw.tfh-wildau.de/~pboettch/home/index.php?site=dvb-usb-firmware
http://www.mail-archive.com/em28xx@mcentral.de/msg00750.html

hg clone http://mcentral.de/hg/~mrec/userspace-drivers
cd userspace-drivers
sudo ./build.sh
cd ..
hg clone http://mcentral.de/hg/~mrec/em28xx-userspace2
cd em28xx-userspace2
sudo ./build.sh

Video for Linux, plus?/
both the V4L1 options and "DVB for Linux"?

wget http://www.linuxtv.org/pipermail/linux-dvb/attachments/20070802/3b2e4d6a/attachment-0001.obj
patch --strip=1 --directory=/home/jelle/v4l-dvb-experimental < attachment-0001.obj

sudo apt-get install mercurial
cd $HOME
hg clone http://linuxtv.org/hg/v4l-dvb
cd v4l-dvb
make
sudo make install
sudo depmod -a

sudo modprobe crc32
sudo modprobe crc32c
sudo modprobe firmware_class

sudo apt-get install kaffeine-xine


sudo apt-get install mercurial
cd $HOME
hg clone http://linuxtv.org/hg/v4l-dvb

rm -r $HOME/v4l-dvb/linux/drivers/media/video/em28xx
cp --verbose --recursive $HOME/v4l-dvb-experimental/linux/drivers/media/video/em28xx $HOME/v4l-dvb/linux/drivers/media/video/em28xx
cd $HOME/v4l-dvb
make clean
make
sudo make install


sudo modprobe i2c-core
sudo modprobe dvb-core
sudo modprobe dvb-pll

sudo modprobe em28xx

sudo find $HOME/v4l-dvb '*' -type f -exec sudo grep -H -n "0x0226" '{}' \;
sudo find $HOME/v4l-dvb '*' -type f -exec sudo grep -H -n "0x2304" '{}' \;

/home/jelle/v4l-dvb/linux/drivers/media/dvb/dvb-usb/dvb-usb-ids.h:122:#define USB_PID_WT220U_FC_WARM       0x0226
/home/jelle/v4l-dvb/linux/drivers/media/dvb/dvb-usb/dvb-usb-ids.h:42:#define USB_VID_PINNACLE              0x2304


sudo apt-get install mercurial linux-headers-$(uname -r) linux-source build-essential
cd ~
wget http://konstantin.filtschew.de/v4l-firmware/firmware_v3.tgz
sudo tar xvz -C /lib/firmware -f firmware_v3.tgz
ls -hal /lib/firmware
rm firmware_v3.tgz

cd ~
hg clone http://linuxtv.org/hg/v4l-dvb
cd v4l-dvb
make
sudo make install

sudo modprobe em2880-dvb

tvtime | arecord -D hw:1,0 -r 32000 -c 2 -f S16_LE | aplay -

hg clone http://mcentral.de/hg/~mrec/v4l-dvb-kernel
cd v4l-dvb-kernel
make module em2880-dvb

cd ~
hg clone http://mcentral.de/hg/~mrec/v4l-dvb-experimental
cd v4l-dvb-experimental
make

hg clone http://mcentral.de/hg/~mrec/v4l-dvb-experimental
cd v4l-dvb-experimental
make
make install

sudo apt-get remove --purge mercurial linux-headers-$(uname -r) linux-source build-essential

Bus 005 Device 015: ID 2304:0226 Pinnacle Systems, Inc. [hex]
Device Descriptor:
  bLength                18
  bDescriptorType         1
  bcdUSB               2.00
  bDeviceClass            0 (Defined at Interface level)
  bDeviceSubClass         0
  bDeviceProtocol         0
  bMaxPacketSize0        64
  idVendor           0x2304 Pinnacle Systems, Inc. [hex]
  idProduct          0x0226
  bcdDevice            1.10
  iManufacturer           3 Pinnacle Systems
  iProduct                1 PCTV 330e
  iSerial                 2 070901090280
  bNumConfigurations      1
  Configuration Descriptor:
    bLength                 9
    bDescriptorType         2
    wTotalLength          305
    bNumInterfaces          1
    bConfigurationValue     1
    iConfiguration          0
    bmAttributes         0x80
      (Bus Powered)
    MaxPower              500mA
    Interface Descriptor:
      bLength                 9
      bDescriptorType         4
      bInterfaceNumber        0
      bAlternateSetting       0
      bNumEndpoints           4
      bInterfaceClass       255 Vendor Specific Class
      bInterfaceSubClass      0
      bInterfaceProtocol    255
      iInterface              0
      Endpoint Descriptor:
        bLength                 7
        bDescriptorType         5
        bEndpointAddress     0x81  EP 1 IN
        bmAttributes            3
          Transfer Type            Interrupt
          Synch Type               None
          Usage Type               Data
        wMaxPacketSize     0x0001  1x 1 bytes
        bInterval              11
      Endpoint Descriptor:
        bLength                 7
        bDescriptorType         5
        bEndpointAddress     0x82  EP 2 IN
        bmAttributes            1
          Transfer Type            Isochronous
          Synch Type               None
          Usage Type               Data
        wMaxPacketSize     0x0000  1x 0 bytes
        bInterval               1
      Endpoint Descriptor:
        bLength                 7
        bDescriptorType         5
        bEndpointAddress     0x83  EP 3 IN
        bmAttributes            1
          Transfer Type            Isochronous
          Synch Type               None
          Usage Type               Data
        wMaxPacketSize     0x0000  1x 0 bytes
        bInterval               4
      Endpoint Descriptor:
        bLength                 7
        bDescriptorType         5
        bEndpointAddress     0x84  EP 4 IN
        bmAttributes            1
          Transfer Type            Isochronous
          Synch Type               None
          Usage Type               Data
        wMaxPacketSize     0x0000  1x 0 bytes
        bInterval               1
    Interface Descriptor:
      bLength                 9
      bDescriptorType         4
      bInterfaceNumber        0
      bAlternateSetting       1
      bNumEndpoints           4
      bInterfaceClass       255 Vendor Specific Class
      bInterfaceSubClass      0
      bInterfaceProtocol    255
      iInterface              0
      Endpoint Descriptor:
        bLength                 7
        bDescriptorType         5
        bEndpointAddress     0x81  EP 1 IN
        bmAttributes            3
          Transfer Type            Interrupt
          Synch Type               None
          Usage Type               Data
        wMaxPacketSize     0x0001  1x 1 bytes
        bInterval              11
      Endpoint Descriptor:
        bLength                 7
        bDescriptorType         5
        bEndpointAddress     0x82  EP 2 IN
        bmAttributes            1
          Transfer Type            Isochronous
          Synch Type               None
          Usage Type               Data
        wMaxPacketSize     0x0000  1x 0 bytes
        bInterval               1
      Endpoint Descriptor:
        bLength                 7
        bDescriptorType         5
        bEndpointAddress     0x83  EP 3 IN
        bmAttributes            1
          Transfer Type            Isochronous
          Synch Type               None
          Usage Type               Data
        wMaxPacketSize     0x00c4  1x 196 bytes
        bInterval               4
      Endpoint Descriptor:
        bLength                 7
        bDescriptorType         5
        bEndpointAddress     0x84  EP 4 IN
        bmAttributes            1
          Transfer Type            Isochronous
          Synch Type               None
          Usage Type               Data
        wMaxPacketSize     0x0234  1x 564 bytes
        bInterval               1
    Interface Descriptor:
      bLength                 9
      bDescriptorType         4
      bInterfaceNumber        0
      bAlternateSetting       2
      bNumEndpoints           4
      bInterfaceClass       255 Vendor Specific Class
      bInterfaceSubClass      0
      bInterfaceProtocol    255
      iInterface              0
      Endpoint Descriptor:
        bLength                 7
        bDescriptorType         5
        bEndpointAddress     0x81  EP 1 IN
        bmAttributes            3
          Transfer Type            Interrupt
          Synch Type               None
          Usage Type               Data
        wMaxPacketSize     0x0001  1x 1 bytes
        bInterval              11
      Endpoint Descriptor:
        bLength                 7
        bDescriptorType         5
        bEndpointAddress     0x82  EP 2 IN
        bmAttributes            1
          Transfer Type            Isochronous
          Synch Type               None
          Usage Type               Data
        wMaxPacketSize     0x0ad4  2x 724 bytes
        bInterval               1
      Endpoint Descriptor:
        bLength                 7
        bDescriptorType         5
        bEndpointAddress     0x83  EP 3 IN
        bmAttributes            1
          Transfer Type            Isochronous
          Synch Type               None
          Usage Type               Data
        wMaxPacketSize     0x00c4  1x 196 bytes
        bInterval               4
      Endpoint Descriptor:
        bLength                 7
        bDescriptorType         5
        bEndpointAddress     0x84  EP 4 IN
        bmAttributes            1
          Transfer Type            Isochronous
          Synch Type               None
          Usage Type               Data
        wMaxPacketSize     0x0234  1x 564 bytes
        bInterval               1
    Interface Descriptor:
      bLength                 9
      bDescriptorType         4
      bInterfaceNumber        0
      bAlternateSetting       3
      bNumEndpoints           4
      bInterfaceClass       255 Vendor Specific Class
      bInterfaceSubClass      0
      bInterfaceProtocol    255
      iInterface              0
      Endpoint Descriptor:
        bLength                 7
        bDescriptorType         5
        bEndpointAddress     0x81  EP 1 IN
        bmAttributes            3
          Transfer Type            Interrupt
          Synch Type               None
          Usage Type               Data
        wMaxPacketSize     0x0001  1x 1 bytes
        bInterval              11
      Endpoint Descriptor:
        bLength                 7
        bDescriptorType         5
        bEndpointAddress     0x82  EP 2 IN
        bmAttributes            1
          Transfer Type            Isochronous
          Synch Type               None
          Usage Type               Data
        wMaxPacketSize     0x0c00  2x 0 bytes
        bInterval               1
      Endpoint Descriptor:
        bLength                 7
        bDescriptorType         5
        bEndpointAddress     0x83  EP 3 IN
        bmAttributes            1
          Transfer Type            Isochronous
          Synch Type               None
          Usage Type               Data
        wMaxPacketSize     0x00c4  1x 196 bytes
        bInterval               4
      Endpoint Descriptor:
        bLength                 7
        bDescriptorType         5
        bEndpointAddress     0x84  EP 4 IN
        bmAttributes            1
          Transfer Type            Isochronous
          Synch Type               None
          Usage Type               Data
        wMaxPacketSize     0x0234  1x 564 bytes
        bInterval               1
    Interface Descriptor:
      bLength                 9
      bDescriptorType         4
      bInterfaceNumber        0
      bAlternateSetting       4
      bNumEndpoints           4
      bInterfaceClass       255 Vendor Specific Class
      bInterfaceSubClass      0
      bInterfaceProtocol    255
      iInterface              0
      Endpoint Descriptor:
        bLength                 7
        bDescriptorType         5
        bEndpointAddress     0x81  EP 1 IN
        bmAttributes            3
          Transfer Type            Interrupt
          Synch Type               None
          Usage Type               Data
        wMaxPacketSize     0x0001  1x 1 bytes
        bInterval              11
      Endpoint Descriptor:
        bLength                 7
        bDescriptorType         5
        bEndpointAddress     0x82  EP 2 IN
        bmAttributes            1
          Transfer Type            Isochronous
          Synch Type               None
          Usage Type               Data
        wMaxPacketSize     0x1300  3x 768 bytes
        bInterval               1
      Endpoint Descriptor:
        bLength                 7
        bDescriptorType         5
        bEndpointAddress     0x83  EP 3 IN
        bmAttributes            1
          Transfer Type            Isochronous
          Synch Type               None
          Usage Type               Data
        wMaxPacketSize     0x00c4  1x 196 bytes
        bInterval               4
      Endpoint Descriptor:
        bLength                 7
        bDescriptorType         5
        bEndpointAddress     0x84  EP 4 IN
        bmAttributes            1
          Transfer Type            Isochronous
          Synch Type               None
          Usage Type               Data
        wMaxPacketSize     0x0234  1x 564 bytes
        bInterval               1
    Interface Descriptor:
      bLength                 9
      bDescriptorType         4
      bInterfaceNumber        0
      bAlternateSetting       5
      bNumEndpoints           4
      bInterfaceClass       255 Vendor Specific Class
      bInterfaceSubClass      0
      bInterfaceProtocol    255
      iInterface              0
      Endpoint Descriptor:
        bLength                 7
        bDescriptorType         5
        bEndpointAddress     0x81  EP 1 IN
        bmAttributes            3
          Transfer Type            Interrupt
          Synch Type               None
          Usage Type               Data
        wMaxPacketSize     0x0001  1x 1 bytes
        bInterval              11
      Endpoint Descriptor:
        bLength                 7
        bDescriptorType         5
        bEndpointAddress     0x82  EP 2 IN
        bmAttributes            1
          Transfer Type            Isochronous
          Synch Type               None
          Usage Type               Data
        wMaxPacketSize     0x135c  3x 860 bytes
        bInterval               1
      Endpoint Descriptor:
        bLength                 7
        bDescriptorType         5
        bEndpointAddress     0x83  EP 3 IN
        bmAttributes            1
          Transfer Type            Isochronous
          Synch Type               None
          Usage Type               Data
        wMaxPacketSize     0x00c4  1x 196 bytes
        bInterval               4
      Endpoint Descriptor:
        bLength                 7
        bDescriptorType         5
        bEndpointAddress     0x84  EP 4 IN
        bmAttributes            1
          Transfer Type            Isochronous
          Synch Type               None
          Usage Type               Data
        wMaxPacketSize     0x0234  1x 564 bytes
        bInterval               1
    Interface Descriptor:
      bLength                 9
      bDescriptorType         4
      bInterfaceNumber        0
      bAlternateSetting       6
      bNumEndpoints           4
      bInterfaceClass       255 Vendor Specific Class
      bInterfaceSubClass      0
      bInterfaceProtocol    255
      iInterface              0
      Endpoint Descriptor:
        bLength                 7
        bDescriptorType         5
        bEndpointAddress     0x81  EP 1 IN
        bmAttributes            3
          Transfer Type            Interrupt
          Synch Type               None
          Usage Type               Data
        wMaxPacketSize     0x0001  1x 1 bytes
        bInterval              11
      Endpoint Descriptor:
        bLength                 7
        bDescriptorType         5
        bEndpointAddress     0x82  EP 2 IN
        bmAttributes            1
          Transfer Type            Isochronous
          Synch Type               None
          Usage Type               Data
        wMaxPacketSize     0x13c4  3x 964 bytes
        bInterval               1
      Endpoint Descriptor:
        bLength                 7
        bDescriptorType         5
        bEndpointAddress     0x83  EP 3 IN
        bmAttributes            1
          Transfer Type            Isochronous
          Synch Type               None
          Usage Type               Data
        wMaxPacketSize     0x00c4  1x 196 bytes
        bInterval               4
      Endpoint Descriptor:
        bLength                 7
        bDescriptorType         5
        bEndpointAddress     0x84  EP 4 IN
        bmAttributes            1
          Transfer Type            Isochronous
          Synch Type               None
          Usage Type               Data
        wMaxPacketSize     0x0234  1x 564 bytes
        bInterval               1
    Interface Descriptor:
      bLength                 9
      bDescriptorType         4
      bInterfaceNumber        0
      bAlternateSetting       7
      bNumEndpoints           4
      bInterfaceClass       255 Vendor Specific Class
      bInterfaceSubClass      0
      bInterfaceProtocol    255
      iInterface              0
      Endpoint Descriptor:
        bLength                 7
        bDescriptorType         5
        bEndpointAddress     0x81  EP 1 IN
        bmAttributes            3
          Transfer Type            Interrupt
          Synch Type               None
          Usage Type               Data
        wMaxPacketSize     0x0001  1x 1 bytes
        bInterval              11
      Endpoint Descriptor:
        bLength                 7
        bDescriptorType         5
        bEndpointAddress     0x82  EP 2 IN
        bmAttributes            1
          Transfer Type            Isochronous
          Synch Type               None
          Usage Type               Data
        wMaxPacketSize     0x1400  3x 0 bytes
        bInterval               1
      Endpoint Descriptor:
        bLength                 7
        bDescriptorType         5
        bEndpointAddress     0x83  EP 3 IN
        bmAttributes            1
          Transfer Type            Isochronous
          Synch Type               None
          Usage Type               Data
        wMaxPacketSize     0x00c4  1x 196 bytes
        bInterval               4
      Endpoint Descriptor:
        bLength                 7
        bDescriptorType         5
        bEndpointAddress     0x84  EP 4 IN
        bmAttributes            1
          Transfer Type            Isochronous
          Synch Type               None
          Usage Type               Data
        wMaxPacketSize     0x0234  1x 564 bytes
        bInterval               1
Device Qualifier (for other device speed):
  bLength                10
  bDescriptorType         6
  bcdUSB               2.00
  bDeviceClass            0 (Defined at Interface level)
  bDeviceSubClass         0
  bDeviceProtocol         0
  bMaxPacketSize0        64
  bNumConfigurations      1
Device Status:     0x0000
  (Bus Powered)

--------------060602040104030307040605
Content-Type: text/plain; charset="us-ascii"
MIME-Version: 1.0
Content-Transfer-Encoding: 7bit
Content-Disposition: inline

_______________________________________________
linux-dvb mailing list
linux-dvb@linuxtv.org
http://www.linuxtv.org/cgi-bin/mailman/listinfo/linux-dvb
--------------060602040104030307040605--
