Return-path: <video4linux-list-bounces@redhat.com>
Received: from mx1.redhat.com (ext-mx07.extmail.prod.ext.phx2.redhat.com
	[10.5.110.11])
	by int-mx02.intmail.prod.int.phx2.redhat.com (8.13.8/8.13.8) with ESMTP
	id o4KIJ171016898
	for <video4linux-list@redhat.com>; Thu, 20 May 2010 14:19:01 -0400
Received: from mail-vw0-f46.google.com (mail-vw0-f46.google.com
	[209.85.212.46])
	by mx1.redhat.com (8.13.8/8.13.8) with ESMTP id o4KIIoiD007401
	for <video4linux-list@redhat.com>; Thu, 20 May 2010 14:18:50 -0400
Received: by vws9 with SMTP id 9so131209vws.33
	for <video4linux-list@redhat.com>; Thu, 20 May 2010 11:18:50 -0700 (PDT)
MIME-Version: 1.0
Date: Thu, 20 May 2010 23:39:12 +0545
Message-ID: <AANLkTinXgN5IzdctnwRAGREVAEt8eiASioDxROP-p8_m@mail.gmail.com>
Subject: no working driver for usb tv tuner [ id : 6000:560a ]
From: vikas chauhan <presentisgood@gmail.com>
To: video4linux-list@redhat.com
List-Unsubscribe: <https://www.redhat.com/mailman/options/video4linux-list>,
	<mailto:video4linux-list-request@redhat.com?subject=unsubscribe>
List-Archive: <https://www.redhat.com/mailman/private/video4linux-list>
List-Post: <mailto:video4linux-list@redhat.com>
List-Help: <mailto:video4linux-list-request@redhat.com?subject=help>
List-Subscribe: <https://www.redhat.com/mailman/listinfo/video4linux-list>,
	<mailto:video4linux-list-request@redhat.com?subject=subscribe>
Content-Type: text/plain; charset="us-ascii"
Content-Transfer-Encoding: 7bit
Sender: video4linux-list-bounces@redhat.com
Errors-To: video4linux-list-bounces@redhat.com
List-ID: <video4linux-list@redhat.com>

Hi,
I recently bought an external ( USB ) tv tuner card from hytech. It reports
itself as a trident chip with vendor id : 0x6000 and product id as 0x560a. I
googled, and found that tm6000 driver may be my best bet. I captured the
latest v4l hg snapshot ( from http://linuxtv.org/hg/v4l-dvb/ ) and with a
few changes in the Makefiles ( since tm6000 is in staging and is not
compiled by default ), I managed to compile it.But on loading the driver,
nothing is happening. I checked the dmesg and there is nothing reported.
"lsusb -vvv"shows device as :

 *Bus 002 Device 006: ID 6000:560a
Device Descriptor:
  bLength                18
  bDescriptorType         1
  bcdUSB               2.00
  bDeviceClass            0 (Defined at Interface level)
  bDeviceSubClass         0
  bDeviceProtocol         0
  bMaxPacketSize0        64
  idVendor           0x6000
  idProduct          0x560a
  bcdDevice            0.01
  iManufacturer          16 Trident
  iProduct               32 USB2.0 TV BOX
  iSerial                64 2004090820040908
  bNumConfigurations      1
  Configuration Descriptor:
    bLength                 9
    bDescriptorType         2
    wTotalLength           78
    bNumInterfaces          1
    bConfigurationValue     1
    iConfiguration         48 2.0
    bmAttributes         0x80
      (Bus Powered)
    MaxPower              500mA
    Interface Descriptor:
      bLength                 9
      bDescriptorType         4
      bInterfaceNumber        0
      bAlternateSetting       0
      bNumEndpoints           2
      bInterfaceClass       255 Vendor Specific Class
      bInterfaceSubClass      0
      bInterfaceProtocol    255
      iInterface              0
      Endpoint Descriptor:
        bLength                 7
        bDescriptorType         5
        bEndpointAddress     0x81  EP 1 IN
        bmAttributes            1
          Transfer Type            Isochronous
          Synch Type               None
          Usage Type               Data
        wMaxPacketSize     0x0000  1x 0 bytes
        bInterval               1
      Endpoint Descriptor:
        bLength                 7
        bDescriptorType         5
        bEndpointAddress     0x82  EP 2 IN
        bmAttributes            2
          Transfer Type            Bulk
          Synch Type               None
          Usage Type               Data
        wMaxPacketSize     0x0200  1x 512 bytes
        bInterval               0
    Interface Descriptor:
      bLength                 9
      bDescriptorType         4
      bInterfaceNumber        0
      bAlternateSetting       1
      bNumEndpoints           2
      bInterfaceClass       255 Vendor Specific Class
      bInterfaceSubClass      0
      bInterfaceProtocol    255
      iInterface              0
      Endpoint Descriptor:
        bLength                 7
        bDescriptorType         5
        bEndpointAddress     0x81  EP 1 IN
        bmAttributes            1
          Transfer Type            Isochronous
          Synch Type               None
          Usage Type               Data
        wMaxPacketSize     0x1400  3x 1024 bytes
        bInterval               1
      Endpoint Descriptor:
        bLength                 7
        bDescriptorType         5
        bEndpointAddress     0x82  EP 2 IN
        bmAttributes            2
          Transfer Type            Bulk
          Synch Type               None
          Usage Type               Data
        wMaxPacketSize     0x0200  1x 512 bytes
        bInterval               0
    Interface Descriptor:
      bLength                 9
      bDescriptorType         4
      bInterfaceNumber        0
      bAlternateSetting       2
      bNumEndpoints           2
      bInterfaceClass       255 Vendor Specific Class
      bInterfaceSubClass      0
      bInterfaceProtocol    255
      iInterface              0
      Endpoint Descriptor:
        bLength                 7
        bDescriptorType         5
        bEndpointAddress     0x81  EP 1 IN
        bmAttributes            1
          Transfer Type            Isochronous
          Synch Type               None
          Usage Type               Data
        wMaxPacketSize     0x1400  3x 1024 bytes
        bInterval               1
      Endpoint Descriptor:
        bLength                 7
        bDescriptorType         5
        bEndpointAddress     0x82  EP 2 IN
        bmAttributes            2
          Transfer Type            Bulk
          Synch Type               None
          Usage Type               Data
        wMaxPacketSize     0x0200  1x 512 bytes
        bInterval               0
Device Qualifier (for other device speed):
  bLength                10
  bDescriptorType         6
  bcdUSB               2.00
  bDeviceClass            0 (Defined at Interface level)
  bDeviceSubClass         0
  bDeviceProtocol         0
  bMaxPacketSize0        64
  bNumConfigurations      1
Device Status:     0x0002
  (Bus Powered)
  Remote Wakeup Enabled*

Is this device even supported at this time or am I doing something wrong ?

Regards,
Vikas
--
video4linux-list mailing list
Unsubscribe mailto:video4linux-list-request@redhat.com?subject=unsubscribe
https://www.redhat.com/mailman/listinfo/video4linux-list
