Return-path: <linux-media-owner@vger.kernel.org>
Received: from mail.gmx.net ([213.165.64.20]:35726 "HELO mail.gmx.net"
	rhost-flags-OK-OK-OK-OK) by vger.kernel.org with SMTP
	id S1753976AbZCYT1f (ORCPT <rfc822;linux-media@vger.kernel.org>);
	Wed, 25 Mar 2009 15:27:35 -0400
Date: Wed, 25 Mar 2009 20:27:44 +0100 (CET)
From: Guennadi Liakhovetski <g.liakhovetski@gmx.de>
To: Linux Media Mailing List <linux-media@vger.kernel.org>
cc: Sid Boyce <sboyce@blueyonder.co.uk>
Subject: Asus PG221 monitor camera sensor not recognised
Message-ID: <Pine.LNX.4.64.0903252026380.5795@axis700.grange>
MIME-Version: 1.0
Content-Type: TEXT/PLAIN; charset=US-ASCII
Sender: linux-media-owner@vger.kernel.org
List-ID: <linux-media.vger.kernel.org>

Forwarding to linux-media for a better chance for a reply.

---
Guennadi Liakhovetski, Ph.D.
Freelance Open-Source Software Developer

---------- Forwarded message ----------
Date: Wed, 25 Mar 2009 17:08:05 +0000
From: Sid Boyce <sboyce@blueyonder.co.uk>
To: linux-usb@vger.kernel.org
Subject: Asus PG221 monitor camera sensor not recognised

The camera has never worked though it used to be enumerated as
/dev/videoX with sensor s5k83a in earlier kernels.
gspca: main v2.4.0 registered
gspca: probing 0402:5602
ALi m5602: Probing for a po1030 sensor
ALi m5602: Probing for a mt9m111 sensor
ALi m5602: Probing for a s5k4aa sensor
ALi m5602: Probing for an ov9650 sensor
ALi m5602: Probing for a s5k83a sensor
ALi m5602: Failed to find a sensor
ALi m5602: ALi m5602 webcam failed
usbcore: registered new interface driver ALi m5602
ALi m5602: registered

lsusb -vv
Bus 001 Device 012: ID 0402:5602 ALi Corp. Video Camera Controller
Device Descriptor:
  bLength                18
  bDescriptorType         1
  bcdUSB               2.00
  bDeviceClass            0 (Defined at Interface level)
  bDeviceSubClass         0
  bDeviceProtocol         0
  bMaxPacketSize0        64
  idVendor           0x0402 ALi Corp.
  idProduct          0x5602 Video Camera Controller
  bcdDevice            1.00
  iManufacturer           0
  iProduct                1 USB2.0 Camera
  iSerial                 0
  bNumConfigurations      1
  Configuration Descriptor:
    bLength                 9
    bDescriptorType         2
    wTotalLength          101
    bNumInterfaces          1
    bConfigurationValue     1
    iConfiguration          0
    bmAttributes         0xa0
      (Bus Powered)
      Remote Wakeup
    MaxPower              500mA
    Interface Descriptor:
      bLength                 9
      bDescriptorType         4
      bInterfaceNumber        0
      bAlternateSetting       0
      bNumEndpoints           2
      bInterfaceClass       255 Vendor Specific Class
      bInterfaceSubClass    255 Vendor Specific Subclass
      bInterfaceProtocol    255 Vendor Specific Protocol
      iInterface              0
      Endpoint Descriptor:
        bLength                 7
        bDescriptorType         5
        bEndpointAddress     0x81  EP 1 IN
        bmAttributes            1
          Transfer Type            Isochronous
          Synch Type               None
          Usage Type               Data
        wMaxPacketSize     0x0000  1x 0 bytes
        bInterval               1
      Endpoint Descriptor:
        bLength                 7
        bDescriptorType         5
        bEndpointAddress     0x82  EP 2 IN
        bmAttributes            3
          Transfer Type            Interrupt
          Synch Type               None
          Usage Type               Data
        wMaxPacketSize     0x0000  1x 0 bytes
        bInterval               4
    Interface Descriptor:
      bLength                 9
      bDescriptorType         4
      bInterfaceNumber        0
      bAlternateSetting       1
      bNumEndpoints           2
      bInterfaceClass       255 Vendor Specific Class
      bInterfaceSubClass    255 Vendor Specific Subclass
      bInterfaceProtocol    255 Vendor Specific Protocol
      iInterface              0
      Endpoint Descriptor:
        bLength                 7
        bDescriptorType         5
        bEndpointAddress     0x81  EP 1 IN
        bmAttributes            1
          Transfer Type            Isochronous
          Synch Type               None
          Usage Type               Data
        wMaxPacketSize     0x1400  3x 1024 bytes
        bInterval               1
      Endpoint Descriptor:
        bLength                 7
        bDescriptorType         5
        bEndpointAddress     0x82  EP 2 IN
        bmAttributes            3
          Transfer Type            Interrupt
          Synch Type               None
          Usage Type               Data
        wMaxPacketSize     0x0010  1x 16 bytes
        bInterval               4
    Interface Descriptor:
      bLength                 9
      bDescriptorType         4
      bInterfaceNumber        0
      bAlternateSetting       2
      bNumEndpoints           2
      bInterfaceClass       255 Vendor Specific Class
      bInterfaceSubClass    255 Vendor Specific Subclass
      bInterfaceProtocol    255 Vendor Specific Protocol
      iInterface              0
      Endpoint Descriptor:
        bLength                 7
        bDescriptorType         5
        bEndpointAddress     0x81  EP 1 IN
        bmAttributes            1
          Transfer Type            Isochronous
          Synch Type               None
          Usage Type               Data
        wMaxPacketSize     0x1380  3x 896 bytes
        bInterval               1
      Endpoint Descriptor:
        bLength                 7
        bDescriptorType         5
        bEndpointAddress     0x82  EP 2 IN
        bmAttributes            3
          Transfer Type            Interrupt
          Synch Type               None
          Usage Type               Data
        wMaxPacketSize     0x0010  1x 16 bytes
        bInterval               4
    Interface Descriptor:
      bLength                 9
      bDescriptorType         4
      bInterfaceNumber        0
      bAlternateSetting       3
      bNumEndpoints           2
      bInterfaceClass       255 Vendor Specific Class
      bInterfaceSubClass    255 Vendor Specific Subclass
      bInterfaceProtocol    255 Vendor Specific Protocol
      iInterface              0
      Endpoint Descriptor:
        bLength                 7
        bDescriptorType         5
        bEndpointAddress     0x81  EP 1 IN
        bmAttributes            1
          Transfer Type            Isochronous
          Synch Type               None
          Usage Type               Data
        wMaxPacketSize     0x1300  3x 768 bytes
        bInterval               1
      Endpoint Descriptor:
        bLength                 7
        bDescriptorType         5
        bEndpointAddress     0x82  EP 2 IN
        bmAttributes            3
          Transfer Type            Interrupt
          Synch Type               None
          Usage Type               Data
        wMaxPacketSize     0x0010  1x 16 bytes
        bInterval               4
Device Qualifier (for other device speed):
  bLength                10
  bDescriptorType         6
  bcdUSB               2.00
  bDeviceClass            0 (Defined at Interface level)
  bDeviceSubClass         0
  bDeviceProtocol         0
  bMaxPacketSize0        64
  bNumConfigurations      1
Device Status:     0x0000
  (Bus Powered)

Regards
Sid.
-- 
Sid Boyce ... Hamradio License G3VBV, Licensed Private Pilot
Emeritus IBM/Amdahl Mainframes and Sun/Fujitsu Servers Tech Support
Specialist, Cricket Coach
Microsoft Windows Free Zone - Linux used for all Computing Tasks

--
To unsubscribe from this list: send the line "unsubscribe linux-usb" in
the body of a message to majordomo@vger.kernel.org
More majordomo info at  http://vger.kernel.org/majordomo-info.html
