Return-path: <linux-dvb-bounces+mchehab=infradead.org@linuxtv.org>
Received: from mo-p00-ob.rzone.de ([81.169.146.162])
	by www.linuxtv.org with esmtp (Exim 4.63)
	(envelope-from <robert@au-79.de>) id 1KIeGQ-0003qg-8X
	for linux-dvb@linuxtv.org; Tue, 15 Jul 2008 08:43:55 +0200
From: "Robert Goldner" <robert@au-79.de>
To: linux-dvb@linuxtv.org
Date: Tue, 15 Jul 2008 08:43:45 +0200
Mime-Version: 1.0
Message-Id: <20080715064346.01ACC1BC39@agathe>
Subject: [linux-dvb] unknown dvbt device 1ae7:0381 Xtensions 380U
List-Unsubscribe: <http://www.linuxtv.org/cgi-bin/mailman/listinfo/linux-dvb>,
	<mailto:linux-dvb-request@linuxtv.org?subject=unsubscribe>
List-Archive: <http://www.linuxtv.org/pipermail/linux-dvb>
List-Post: <mailto:linux-dvb@linuxtv.org>
List-Help: <mailto:linux-dvb-request@linuxtv.org?subject=help>
List-Subscribe: <http://www.linuxtv.org/cgi-bin/mailman/listinfo/linux-dvb>,
	<mailto:linux-dvb-request@linuxtv.org?subject=subscribe>
Content-Type: text/plain; charset="us-ascii"
Content-Transfer-Encoding: 7bit
Sender: linux-dvb-bounces@linuxtv.org
Errors-To: linux-dvb-bounces+mchehab=infradead.org@linuxtv.org
List-ID: <linux-dvb@linuxtv.org>

Hi,

has anyone ever tryed to get the Xtensions 380 working with linux?

url:

http://www.x-tensions.net/support.php?lang=de&view=solo&prod_num=XD-380
But be carefull with the driver on this page. It differs a lot against the 
driver included at the CD delivered with the stick.

I had a look into the windows driver (on the CD) and found nothing what
could give an information which linux-driver is the right one (in my eyes). 
If it is useful, I can put the windows driver to the www.

Is there any realistic hope, to get this device work with linux? I will
test any patches and try any hints etc.

lsusb:
1ae7:0381

lsusb -vvv:

Bus 001 Device 007: ID 1ae7:0381
Device Descriptor:
  bLength                18
  bDescriptorType         1
  bcdUSB               2.00
  bDeviceClass            0 (Defined at Interface level)
  bDeviceSubClass         0
  bDeviceProtocol         0
  bMaxPacketSize0        64
  idVendor           0x1ae7
  idProduct          0x0381
  bcdDevice            2.00
  iManufacturer           1 Afatech
  iProduct                2 DVB-T 2
  iSerial                 0
  bNumConfigurations      1
  Configuration Descriptor:
    bLength                 9
    bDescriptorType         2
    wTotalLength           46
    bNumInterfaces          1
    bConfigurationValue     1
    iConfiguration          0
    bmAttributes         0x80
      (Bus Powered)
    MaxPower              500mA
    Interface Descriptor:
      bLength                 9
      bDescriptorType         4
      bInterfaceNumber        0
      bAlternateSetting       0
      bNumEndpoints           4
      bInterfaceClass       255 Vendor Specific Class
      bInterfaceSubClass      0
      bInterfaceProtocol      0
      iInterface              0
      Endpoint Descriptor:
        bLength                 7
        bDescriptorType         5
        bEndpointAddress     0x81  EP 1 IN
        bmAttributes            2
          Transfer Type            Bulk
          Synch Type               None
          Usage Type               Data
        wMaxPacketSize     0x0200  1x 512 bytes
        bInterval               0
      Endpoint Descriptor:
        bLength                 7
        bDescriptorType         5
        bEndpointAddress     0x02  EP 2 OUT
        bmAttributes            2
          Transfer Type            Bulk
          Synch Type               None
          Usage Type               Data
        wMaxPacketSize     0x0200  1x 512 bytes
        bInterval               0
      Endpoint Descriptor:
        bLength                 7
        bDescriptorType         5
        bEndpointAddress     0x84  EP 4 IN
        bmAttributes            2
          Transfer Type            Bulk
          Synch Type               None
          Usage Type               Data
        wMaxPacketSize     0x0200  1x 512 bytes
        bInterval               0
      Endpoint Descriptor:
        bLength                 7
        bDescriptorType         5
        bEndpointAddress     0x85  EP 5 IN
        bmAttributes            2
          Transfer Type            Bulk
          Synch Type               None
          Usage Type               Data
        wMaxPacketSize     0x0200  1x 512 bytes
        bInterval               0
Device Qualifier (for other device speed):
  bLength                10
  bDescriptorType         6
  bcdUSB               2.00
  bDeviceClass            0 (Defined at Interface level)
  bDeviceSubClass         0
  bDeviceProtocol         0
  bMaxPacketSize0        64
  bNumConfigurations      1
Device Status:     0x0000
  (Bus Powered)

Best regards

Robert


_______________________________________________
linux-dvb mailing list
linux-dvb@linuxtv.org
http://www.linuxtv.org/cgi-bin/mailman/listinfo/linux-dvb
